{
  "schemaVersion": "1.0.0",
  "frameworkId": "ncom",
  "commit": "a350b576bbeae6c6254273037a17d2a8730fb80f",
  "generatedAt": "2026-07-30T08:03:42.486Z",
  "components": [
    {
      "component": "NCCard",
      "commit": "a350b576bbeae6c6254273037a17d2a8730fb80f",
      "imports": [
        "import { NCCard } from \"@ncom/all\";",
        "import { NCCard } from \"@ncom/components\";"
      ],
      "attributes": [
        {
          "value": {
            "name": "body-style",
            "type": "string",
            "defaultValue": null
          },
          "sources": [
            "official-doc",
            "type-definition"
          ],
          "evidenceRefs": [
            {
              "sourceId": "ncom-repository-docs",
              "sourceType": "official-doc",
              "path": ".framework-sources/ncom-a350b57/doc/api/components/card.md",
              "url": null,
              "lineStart": 18,
              "lineEnd": 18,
              "sha256": "sha256:b6f9d4c259290a5a98e96f110029a9e48621e83241e0f9ab049f7c2b729b0ce4",
              "commit": "a350b576bbeae6c6254273037a17d2a8730fb80f"
            },
            {
              "sourceId": "symbol:symbol-6aa26298b95a9ac6",
              "sourceType": "type-definition",
              "path": "packages/components/src/card/types.ts",
              "url": null,
              "lineStart": 9,
              "lineEnd": 9,
              "sha256": "sha256:563f74dbdfe0e617a21aa8a607c8a9a4ec24e919a321990cd571db7dcb830892",
              "commit": "a350b576bbeae6c6254273037a17d2a8730fb80f"
            }
          ],
          "status": "verified",
          "confidence": "high",
          "lastVerifiedAt": null
        },
        {
          "value": {
            "name": "footer",
            "type": "string",
            "defaultValue": null
          },
          "sources": [
            "official-doc",
            "type-definition"
          ],
          "evidenceRefs": [
            {
              "sourceId": "ncom-repository-docs",
              "sourceType": "official-doc",
              "path": ".framework-sources/ncom-a350b57/doc/api/components/card.md",
              "url": null,
              "lineStart": 17,
              "lineEnd": 17,
              "sha256": "sha256:b6f9d4c259290a5a98e96f110029a9e48621e83241e0f9ab049f7c2b729b0ce4",
              "commit": "a350b576bbeae6c6254273037a17d2a8730fb80f"
            },
            {
              "sourceId": "symbol:symbol-a674451273d32bb6",
              "sourceType": "type-definition",
              "path": "packages/components/src/card/types.ts",
              "url": null,
              "lineStart": 7,
              "lineEnd": 7,
              "sha256": "sha256:563f74dbdfe0e617a21aa8a607c8a9a4ec24e919a321990cd571db7dcb830892",
              "commit": "a350b576bbeae6c6254273037a17d2a8730fb80f"
            }
          ],
          "status": "verified",
          "confidence": "high",
          "lastVerifiedAt": null
        },
        {
          "value": {
            "name": "header",
            "type": "string",
            "defaultValue": null
          },
          "sources": [
            "official-doc",
            "type-definition"
          ],
          "evidenceRefs": [
            {
              "sourceId": "ncom-repository-docs",
              "sourceType": "official-doc",
              "path": ".framework-sources/ncom-a350b57/doc/api/components/card.md",
              "url": null,
              "lineStart": 16,
              "lineEnd": 16,
              "sha256": "sha256:b6f9d4c259290a5a98e96f110029a9e48621e83241e0f9ab049f7c2b729b0ce4",
              "commit": "a350b576bbeae6c6254273037a17d2a8730fb80f"
            },
            {
              "sourceId": "symbol:symbol-74413bcd029f696b",
              "sourceType": "type-definition",
              "path": "packages/components/src/card/types.ts",
              "url": null,
              "lineStart": 6,
              "lineEnd": 6,
              "sha256": "sha256:563f74dbdfe0e617a21aa8a607c8a9a4ec24e919a321990cd571db7dcb830892",
              "commit": "a350b576bbeae6c6254273037a17d2a8730fb80f"
            }
          ],
          "status": "verified",
          "confidence": "high",
          "lastVerifiedAt": null
        },
        {
          "value": {
            "name": "height",
            "type": "string",
            "defaultValue": null
          },
          "sources": [
            "type-definition"
          ],
          "evidenceRefs": [
            {
              "sourceId": "symbol:symbol-0161d76a10cafbe1",
              "sourceType": "type-definition",
              "path": "packages/components/src/card/types.ts",
              "url": null,
              "lineStart": 11,
              "lineEnd": 11,
              "sha256": "sha256:563f74dbdfe0e617a21aa8a607c8a9a4ec24e919a321990cd571db7dcb830892",
              "commit": "a350b576bbeae6c6254273037a17d2a8730fb80f"
            }
          ],
          "status": "inferred",
          "confidence": "medium",
          "lastVerifiedAt": null
        },
        {
          "value": {
            "name": "shadow",
            "type": "string",
            "defaultValue": "always"
          },
          "sources": [
            "official-doc",
            "type-definition"
          ],
          "evidenceRefs": [
            {
              "sourceId": "ncom-repository-docs",
              "sourceType": "official-doc",
              "path": ".framework-sources/ncom-a350b57/doc/api/components/card.md",
              "url": null,
              "lineStart": 19,
              "lineEnd": 19,
              "sha256": "sha256:b6f9d4c259290a5a98e96f110029a9e48621e83241e0f9ab049f7c2b729b0ce4",
              "commit": "a350b576bbeae6c6254273037a17d2a8730fb80f"
            },
            {
              "sourceId": "symbol:symbol-369ca190b7de7991",
              "sourceType": "type-definition",
              "path": "packages/components/src/card/types.ts",
              "url": null,
              "lineStart": 8,
              "lineEnd": 8,
              "sha256": "sha256:563f74dbdfe0e617a21aa8a607c8a9a4ec24e919a321990cd571db7dcb830892",
              "commit": "a350b576bbeae6c6254273037a17d2a8730fb80f"
            }
          ],
          "status": "conflict",
          "confidence": "low",
          "lastVerifiedAt": null
        },
        {
          "value": {
            "name": "width",
            "type": "string",
            "defaultValue": null
          },
          "sources": [
            "type-definition"
          ],
          "evidenceRefs": [
            {
              "sourceId": "symbol:symbol-b89cc6173317d04b",
              "sourceType": "type-definition",
              "path": "packages/components/src/card/types.ts",
              "url": null,
              "lineStart": 10,
              "lineEnd": 10,
              "sha256": "sha256:563f74dbdfe0e617a21aa8a607c8a9a4ec24e919a321990cd571db7dcb830892",
              "commit": "a350b576bbeae6c6254273037a17d2a8730fb80f"
            }
          ],
          "status": "inferred",
          "confidence": "medium",
          "lastVerifiedAt": null
        }
      ],
      "events": [],
      "methods": [],
      "slots": [
        {
          "value": {
            "name": "default",
            "type": null,
            "defaultValue": null
          },
          "sources": [
            "source-code"
          ],
          "evidenceRefs": [
            {
              "sourceId": "symbol:NCCard",
              "sourceType": "source-code",
              "path": "packages/components/src/card/index.ts",
              "url": null,
              "lineStart": 25,
              "lineEnd": 25,
              "sha256": "sha256:37cd9d9ede0cc520809dc0c85fe76ba5c3e63e8d53a1cd9cbc1de4c56005dd69",
              "commit": "a350b576bbeae6c6254273037a17d2a8730fb80f"
            }
          ],
          "status": "inferred",
          "confidence": "medium",
          "lastVerifiedAt": null
        },
        {
          "value": {
            "name": "footer",
            "type": null,
            "defaultValue": null
          },
          "sources": [
            "source-code"
          ],
          "evidenceRefs": [
            {
              "sourceId": "symbol:NCCard",
              "sourceType": "source-code",
              "path": "packages/components/src/card/index.ts",
              "url": null,
              "lineStart": 25,
              "lineEnd": 25,
              "sha256": "sha256:37cd9d9ede0cc520809dc0c85fe76ba5c3e63e8d53a1cd9cbc1de4c56005dd69",
              "commit": "a350b576bbeae6c6254273037a17d2a8730fb80f"
            }
          ],
          "status": "inferred",
          "confidence": "medium",
          "lastVerifiedAt": null
        },
        {
          "value": {
            "name": "header",
            "type": null,
            "defaultValue": null
          },
          "sources": [
            "source-code"
          ],
          "evidenceRefs": [
            {
              "sourceId": "symbol:NCCard",
              "sourceType": "source-code",
              "path": "packages/components/src/card/index.ts",
              "url": null,
              "lineStart": 25,
              "lineEnd": 25,
              "sha256": "sha256:37cd9d9ede0cc520809dc0c85fe76ba5c3e63e8d53a1cd9cbc1de4c56005dd69",
              "commit": "a350b576bbeae6c6254273037a17d2a8730fb80f"
            }
          ],
          "status": "inferred",
          "confidence": "medium",
          "lastVerifiedAt": null
        }
      ],
      "examples": [
        {
          "title": "ex1.ts",
          "description": "固定源码 commit 中登记的官方示例入口。",